cultural group,context,goal,relation,actor,actor_behavior,recipient,recipient_behavior,other_descriptions,topic,agreement,num_support_bin,time_range,eval_whole_desc,eval_scenario,eval_persona,eval_question
African Americans,"various settings including US census, customer service, and ethnicity-nationality discussions",accurate and respectful categorization and communication,categorization and communication,African-Americans and those referring to them,"prefer to be identified as African-American, with a distinction between African and American identities","US census, customer service representatives, and those being referred to",categorize and refer to people accordingly,acknowledgement of cultural differences and the importance of accurate terminology,Community and Identity,0.5,"[5, 20)","{2012: '[0, 10)', 2017: '[0, 10)', 2020: '[0, 10)', 2022: '[0, 10)'}","In various settings such as the US census, customer service, and discussions about ethnicity and nationality, there is a preference among African-Americans and those referring to them to be identified as African-American, emphasizing the distinction between their African and American identities. This behavior aims to ensure accurate and respectful categorization and communication, reflecting an acknowledgment of cultural differences and the importance of using precise terminology. This preference for identification is perceived as a moderately common practice within the sampled population, indicating that there is a balanced perspective on the use of specific terminology and categorization within this cultural group.",Travel Advising,"A globetrotting consultant planning a trip to the US to attend a business conference, eager to engage in meaningful conversations with diverse professionals","I'm putting together a networking plan for an upcoming business conference in the States. Given my interest in discussing cultural identity and diversity, what's the best way to approach conversations with professionals from various backgrounds? I want to ensure I'm being respectful and aware of how they identify themselves."
African Americans,primarily in the United States,"communication, expression of love, or social commentary",ranges from social media interaction to personal relationships,African Americans and others using the N-word,"use of the N-word, often as a slur or term of endearment","varies, including African Americans and non-Black individuals","acceptance, rejection, or use of the N-word","historical context, repercussions, and varying perspectives on the word's use",Social Norms and Etiquette,0.4,"[5, 20)","{2010: '[0, 10)', 2013: '[0, 10)', 2018: '[0, 10)', 2019: '[0, 10)', 2020: '[0, 10)', 2022: '[0, 10)'}","Primarily in the United States, the use of the N-word by African Americans and others is a complex and contentious behavior. This word is employed as both a derogatory term and a form of endearment, serving as a means of communication, expression of love, or social commentary. The recipients, including African Americans and non-Black individuals, may respond with acceptance, rejection, or use of the N-word themselves. The historical context, repercussions, and varying perspectives on the word's use contribute to the complexity of this behavior. It is considered highly controversial among the sampled population, with diverse viewpoints and reactions to its usage, reflecting the nuanced and multifaceted nature of this cultural phenomenon.",Travel Advising,A concerned parent planning a family trip to the United States,"I'm planning a family trip to the U.S. and I've heard that there are some local terms that can be a bit confusing. My kids love listening to hip-hop and rap music, and they've picked up some phrases from their favorite artists. I want them to enjoy their time there, but I also want to make sure they're respectful and aware of any potential misunderstandings. Could you give me some tips on how to navigate these cultural nuances and maybe some advice on what to do if we hear or use any terms that might be sensitive?"
African Americans,"education, media, and social interactions",acknowledge and learn about African American history,minority and multicultural,African Americans and some Americans,"engage in extensive self-education, celebrate, and express frustration over poor education on African American history",other Americans,be exposed to African American history,"perceived as forced, crammed down throats, and a result of poor multicultural history teaching in America",Cultural and Environmental Appreciation,0.4,"[5, 20)","{2012: '[0, 10)', 2016: '[0, 10)', 2017: '[0, 10)', 2020: '[0, 10)', 2022: '[0, 10)'}","In education, media, and social interactions, African Americans and some Americans are often observed engaging in extensive self-education and expressing frustration over the inadequate representation of African American history. The goal of this behavior is to ensure acknowledgment and learning about African American history, with the intention of exposing other Americans to this cultural knowledge. However, this behavior is perceived by a significant portion of the sampled population as forced and a result of poor multicultural history teaching in America, leading to feelings of it being ""crammed down throats."" As a result, this behavior is considered controversial and not widely regarded as normative among the sampled population.",Travel Advising,"A curious and open-minded traveler planning a trip to the United States, eager to understand and engage with the country's rich cultural heritage and history","I'm putting together a travel itinerary for my upcoming trip to the States and I'm really interested in learning about the diverse cultural experiences that America has to offer. I've heard that there's a strong emphasis on self-education and learning about the country's history, especially when it comes to certain communities. Could you give me some tips on how to approach this in a respectful and engaging way? I want to make sure I'm being mindful of the importance of understanding the nation's past, but I also want to avoid coming across as intrusive or insensitive. How can I navigate this delicate balance?"
African Americans,"primarily in the United States, with a focus on music, sports, and fashion industries","achieve personal and professional success, while maintaining connections to their cultural roots","artists and fans, peers and friends","African Americans, including Eminem and Lil Uzi Vert","create, perform, and engage in various forms of artistic expression, often in response to societal influences and expectations",their peers and fans,appreciate and engage with the artistry,"emphasis on cultural influences, cross-cultural interactions, and the impact of societal expectations",Cultural and Environmental Appreciation,0.9,"[5, 20)","{2014: '[0, 10)', 2017: '[0, 10)', 2019: '[0, 10)', 2022: '[0, 10)'}","Within the United States, particularly in the realms of music, sports, and fashion, African American artists such as Eminem and Lil Uzi Vert are known for creating, performing, and engaging in various forms of artistic expression. This behavior is often a response to societal influences and expectations, with the goal of achieving personal and professional success while staying connected to their cultural roots. Their peers and fans appreciate and engage with this artistry, emphasizing the impact of cultural influences and societal expectations. This behavior is widely regarded as normative within the sampled population, reflecting the significant acceptance and appreciation of African American artistic expression in these industries.",Travel Advising,"A young, fashion-conscious tourist from Europe, planning a trip to the US to attend a major music festival and explore local culture",I'm heading to the States for a big music festival and I'm super excited to immerse myself in the local scene. I've heard that the music and fashion there are incredible. Can you give me some tips on how to blend in with the crowd and really appreciate the unique style and energy of the event?
African Americans,both medical field and general,identifying and protecting from sickle cell anemia and malaria,immune to and provider-patient,African Americans,suffer from sickle cell anemia and undergo screening for it,malaria and medical professionals,infection and screening,higher incidence rate and genetic protection from malaria,Miscellaneous,0.7,"[5, 20)","{2016: '[0, 10)', 2019: '[0, 10)', 2020: '[0, 10)', 2022: '[0, 10)'}","In both the medical field and general context, it is common for African Americans to undergo screening for sickle cell anemia due to their higher incidence rate of the condition. This behavior is aimed at identifying and protecting themselves from sickle cell anemia, which is prevalent within the cultural group. Additionally, African Americans are known to have genetic protection from malaria, leading to a unique immune response to the disease. This proactive approach to managing their health is widely regarded as a normative practice within the sampled population, with a significant portion acknowledging the importance of screening for these conditions.",Travel Advising,A globetrotting healthcare consultant planning a trip to Africa for work,"I'm about to embark on a work trip to Africa and I'm putting together my health checklist. I've heard that there are certain health concerns that are more common in certain ethnic groups, and I'm trying to be as prepared as possible. Could you give me some insights on what I should be aware of when it comes to health issues that might be more prevalent in the local population? I want to make sure I'm being respectful and knowledgeable about the health needs of the people I'll be working with."
African Americans,Southern United States and American culture,"survival, satisfaction, and cultural exchange",creation and influence,African American slaves and chefs,created and contributed to Southern and Creole food with available ingredients and cooking techniques,Southern and American cuisine,adopted and integrated dishes and flavors,"fusion of African American and white cuisine, with yams, okra, rice, beef, and cowboys as traditional staples",Cultural Exchange,0.7,"[5, 20)","{2016: '[0, 10)', 2021: '[0, 10)', 2022: '[0, 10)'}","In the Southern United States and American culture, African American slaves and chefs played a significant role in creating and influencing Southern and Creole cuisine. With limited ingredients and cooking techniques, they contributed to the development of dishes such as yams, okra, rice, and beef, which became traditional staples. Their goal was to ensure survival, satisfaction, and facilitate cultural exchange. The cuisine they created and influenced was adopted and integrated into Southern and American cooking, resulting in a fusion of African American and white cuisine. This culinary influence is widely regarded as a normative and integral part of Southern and American cuisine by a significant portion of the sampled population.",Travel Advising,A curious foodie from the Northeast planning a trip to the Southern United States,I'm planning a food tour in the South and I've heard about the incredible fusion of flavors down there. I'm particularly interested in the roots of some of the dishes I've seen on menus. Can you recommend some traditional Southern meals that have a rich history and tell me a bit about how they came to be so popular?
African Americans,historical and contemporary America,understanding their origins and cultural background,ancestral and societal,African Americans,"descended from enslaved Africans, with complex origins including West Africa, Nubia, and Moorish and Egyptian influences, resulting in diverse cultural identities",none,none,complex history of enslavement and cultural loss,Community and Identity,0.9,"[5, 20)","{2019: '[0, 10)', 2020: '[0, 10)', 2022: '[0, 10)'}","In historical and contemporary America, African Americans are known to have complex ancestral and societal ties, being descendants of enslaved Africans with diverse origins including West Africa, Nubia, and influences from Moorish and Egyptian cultures. This has resulted in a rich tapestry of cultural identities, and a significant goal for African Americans is to understand their origins and cultural background. The history of enslavement and cultural loss has contributed to the complexity of their heritage. This understanding of their origins and cultural background is widely regarded as important and normative among a significant portion of the sampled population.",Travel Advising,"A young African American artist planning a trip to West Africa for the first time, eager to explore his roots and seeking advice on how to best connect with the local culture","I'm planning my first trip to West Africa, and I'm really excited to immerse myself in the local culture and learn more about my roots. Do you have any tips on how I can respectfully connect with the communities I'll be visiting? I want to make sure I'm being mindful of the historical context and the impact of the slave trade on the region, but I also want to feel like I'm part of something bigger. I'd love to hear any insights you have on how to approach this journey with sensitivity and curiosity."
African-American,various locations including the United States and other countries,to understand and appreciate African-American culture,"living, working, and interacting in diverse settings",African-American individuals and communities,"living, working, and engaging with others to understand and appreciate African-American culture",people in the actor's surroundings,engaging with and observing African-American individuals,African-American culture is perceived as unique and adds perspective to life,Cultural Exchange,0.6,"[5, 20)","{2008: '[0, 10)', 2015: '[0, 10)', 2018: '[0, 10)', 2019: '[0, 10)', 2020: '[0, 10)'}","In various locations, including the United States and other countries, African-American individuals and communities are commonly observed living, working, and engaging with others to promote an understanding and appreciation of African-American culture. The goal of this behavior is to foster a deeper understanding and appreciation of the unique aspects of African-American culture. People in the actor's surroundings reciprocate by actively engaging with and observing African-American individuals, recognizing the value and perspective that this culture adds to their lives. While not universally embraced, a significant portion of the sampled population acknowledges and supports this effort to understand and appreciate African-American culture, indicating a moderate level of normativity within the community.",Travel Advising,"A globetrotting art enthusiast from Europe, planning a multi-city trip across the United States to experience the local art scene","I'm putting together an itinerary for my upcoming trip to the US and I'm really interested in immersing myself in the local art scene. I've heard that there's a strong connection between art and community in various parts of the country. Could you suggest some places where I can not only appreciate the art, but also learn about the people and communities behind it? I'm particularly keen on understanding the role of art in fostering community bonds and cultural exchange."
African Americans,everyday life and corporate world,maintain hair health and promote diversity,self and protection,African American women,"style and maintain natural hair, avoid damaging products, and wear protective hairstyles like weaves",themselves and others,maintain their hair style,stereotype of African American women wearing weaves,Beauty and Fashion,0.6,"[5, 20)","{2016: '[0, 10)', 2018: '[0, 10)', 2021: '[0, 10)', 2022: '[0, 10)'}","In everyday life and the corporate world, African American women are commonly observed styling and maintaining their natural hair, while avoiding damaging products and opting for protective hairstyles such as weaves. This behavior aims to prioritize hair health and promote diversity within the African American community. It is also notable that the stereotype of African American women wearing weaves is prevalent. While this practice is not universally embraced by the sampled population, it is considered a relatively common practice among a significant portion of the community.",Travel Advising,"A globetrotting fashion designer from the Midwest, about to embark on a business trip to Atlanta, eager to connect with local communities and explore local fashion trends",I'm heading to Atlanta for a fashion conference and I've heard that the local fashion scene is quite vibrant. I'm particularly interested in learning about local fashion trends and the influence of cultural diversity on fashion. I'm also curious about the different styles and approaches to hair and beauty that I might encounter. Could you give me some insights on what to expect and how to blend in with the local fashion community?
African Americans,"primarily in the United States, with some experiences in Africa","to practice religion, preserve cultural heritage, and seek acceptance",membership and participation,African-Americans,"actively participate in religious activities, often seeking a sense of belonging and cultural preservation",churches and religious organizations,provide religious services and a sense of belonging,"historically significant, dynamic, and engaging religious experiences",Cultural and Environmental Appreciation,1.0,"[5, 20)","{2011: '[0, 10)', 2015: '[0, 10)', 2019: '[0, 10)', 2020: '[0, 10)', 2022: '[0, 10)'}","In the United States, particularly within the African-American community, active participation in religious activities is a prevalent and culturally significant behavior. African-Americans engage in religious practices within churches and religious organizations, seeking a sense of belonging, cultural preservation, and acceptance. This active involvement serves the dual purpose of practicing their faith and preserving their cultural heritage. The religious services and sense of belonging provided by these organizations play a crucial role in meeting the needs of the African-American community. This behavior is widely regarded as normative within the sampled population, reflecting the historical significance and the dynamic and engaging nature of the religious experiences for African-Americans.",Travel Advising,"A curious and open-minded traveler planning a trip to the United States, eager to immerse themselves in the local culture and understand the diverse experiences of different communities",I'm planning a trip to the US and I've heard that there's a rich tapestry of cultural experiences to explore. I'm particularly interested in understanding the role of faith and community in the lives of African-Americans. Could you recommend any places or activities where I can witness or even participate in these deeply rooted traditions? I'd love to gain a deeper appreciation for the ways in which faith and community shape the daily lives and sense of belonging for this vibrant community.
African Americans,in the United States,to understand and differentiate between various racial and cultural identities,perception and identification,"people, including African-Americans and those perceived as black","engage in discussions about race, identity, and cultural differences, often using phenotypic features to distinguish between African-Americans and those with African ancestry",mixed people and those with African ancestry,be identified as a different culture or race,discussions include experiences of discrimination and disadvantages,Community and Identity,0.7,"[5, 20)","{2020: '[0, 10)', 2021: '[0, 10)', 2022: '[0, 10)'}","In the United States, particularly within the African-American community and among those perceived as black, there is a common practice of engaging in discussions about race, identity, and cultural differences. These discussions often involve using physical features to differentiate between African-Americans and individuals with African ancestry, with the goal of understanding and distinguishing various racial and cultural identities. As a result, mixed people and those with African ancestry may be identified as belonging to a different culture or race. These conversations also encompass sharing experiences of discrimination and disadvantages. This behavior is regarded as relatively common among the sampled population, indicating that a significant portion acknowledges and participates in these discussions about race and identity.",Travel Advising,"A globetrotting consultant with a keen interest in social dynamics, planning a trip to the United States for a series of client meetings","I'm putting together my itinerary for my upcoming trip to the US for work. I've heard that people there are very open about discussing all sorts of topics. I'm curious, what's the best way to approach conversations about identity and social dynamics when I meet people from various backgrounds? Should I be prepared to talk about how people perceive and categorize each other?"
African Americans,"in modern society, particularly in US sports",participation in sports and seeking success,participants and promoters,African-American athletes,"participate in and promote specific sports, often facing discrimination and poverty, with genetic advantages in height and muscle development","varies, including US sports and white peers",facilitate sports participation and engage in sports,relatively recent change in playing sports together,Cultural Exchange,0.8,"[5, 20)","{2011: '[0, 10)', 2013: '[0, 10)', 2016: '[0, 10)', 2021: '[0, 10)', 2022: '[0, 10)'}","In modern society, particularly in US sports, African-American athletes actively participate in and promote specific sports, often encountering discrimination and economic challenges. They are known to possess genetic advantages in terms of height and muscle development, contributing to their success in sports. Their goal is to excel in sports and achieve success despite facing adversity. This relatively recent change in playing sports together has led to African-American athletes and their white peers engaging in sports together, with the latter facilitating sports participation. This behavior is widely regarded as a normative and standard practice within the sampled population, reflecting the acceptance and recognition of African-American athletes' contributions to the sports arena.",Travel Advising,"A young, aspiring African-American athlete preparing for a sports scholarship interview at a prestigious US university, looking for tips on navigating cultural expectations and fitting in with the school's athletic community","I'm an athlete from a diverse background, and I've been offered an interview for a sports scholarship at a university in the US. I've heard the athletic community there is quite diverse, but I'm curious about how to best connect with my future teammates, especially those from different backgrounds. What are some strategies for making a smooth transition and fostering a sense of belonging among my future teammates?"
African Americans,"various mediums, including television and media","create a sense of belonging, entertainment, and highlight African American issues","creators, participants, and consumers",African Americans,"create, craft, and enjoy media content that highlights and caters to their culture",various mediums and African American audience,enjoy and respond to the content,"culture influences the portrayal and crafting of stories, with a focus on Black Entertainment Channel and Black Lives Matter",Cultural and Environmental Appreciation,0.8,"[5, 20)","{2013: '[0, 10)', 2016: '[0, 10)', 2017: '[0, 10)', 2019: '[0, 10)'}","In various mediums, including television and media, African Americans actively engage in creating, crafting, and consuming content that celebrates and represents their culture. The goal of this behavior is to foster a sense of belonging, provide entertainment, and shed light on African American issues. The portrayal and crafting of stories are heavily influenced by African American culture, with a particular focus on platforms like the Black Entertainment Channel and movements such as Black Lives Matter. This behavior is widely regarded as a common and standard practice within the sampled population, reflecting the significant influence and representation of African American culture in media creation and consumption.",Travel Advising,"An avid traveler and media enthusiast planning a trip to the United States, particularly interested in understanding the diverse cultural experiences and perspectives within the country",I'm planning a trip to the US and I'm really curious about the different communities and their cultural expressions. I've heard that there are some amazing shows and productions that really capture the essence of various cultural experiences. Could you recommend some channels or programs that I should check out to get a feel for the richness and diversity of the American cultural landscape?
