cultural group,context,goal,relation,actor,actor_behavior,recipient,recipient_behavior,other_descriptions,topic,agreement,num_support_bin,time_range,eval_whole_desc,eval_scenario,eval_persona,eval_question
Americans and African artists,music scene,create music that resonates with diverse audiences,inspiration and performance,artists from both cultures,draw inspiration from each other's cultures and blend styles to create unique music,audiences of various backgrounds,appreciate and consume music with diverse cultural influences,cross-cultural communication and mixing of cultures,Cultural Exchange,0.5,"[5, 20)","{2013: '[0, 10)', 2018: '[0, 10)', 2020: '[0, 10)', 2021: '[0, 10)'}","In the music scene, both American and African artists engage in a cultural exchange, drawing inspiration from each other's traditions and blending their styles to create music that resonates with diverse audiences. This cross-cultural communication and mixing of musical influences result in the creation of unique and eclectic music. Audiences from various backgrounds appreciate and consume this music, showcasing an openness to diverse cultural influences. While this behavior is not universally prevalent, it is perceived as a common and accepted practice within the sampled population, indicating a balanced level of normativity.",Travel Advising,"A globe-trotting music enthusiast planning a trip to Africa, eager to immerse themselves in the local music scene and discover new sounds, while also seeking to connect with the local community",I'm a huge fan of music and I'm planning a trip to Africa to explore the local music scene. I've heard that there's a lot of cross-cultural exchange happening in the music scene over there. I'm really excited to see how this influences the music I'll get to experience. Do you have any tips on how I can make the most of my trip and connect with the local music community? I'm especially interested in finding venues where I can hear artists who are blending different styles and traditions.
African Americans,within the United States,to preserve and distinguish their cultural identity,within the same cultural group and as a minority group,African-Americans,"strive to maintain and express their unique cultural identity, including seeking out cultural roots, preserving traditions, and acknowledging regional differences",other African-Americans and American society,acknowledge and support racial division,shaped by historical factors such as slavery and segregation,Community and Identity,0.9,"[70, 80)","{2013: '[0, 10)', 2014: '[0, 10)', 2015: '[0, 10)', 2016: '[0, 10)', 2017: '[0, 10)', 2018: '[0, 10)', 2019: '[0, 10)', 2020: '[10, 20)', 2021: '[0, 10)', 2022: '[20, 30)'}","Within the United States, African-Americans actively strive to maintain and express their unique cultural identity, which involves seeking out their cultural roots, preserving traditions, and acknowledging regional differences. This behavior is aimed at preserving and distinguishing their cultural identity, shaped by historical factors such as slavery and segregation. Within the African-American community and as a minority group, there is a prevalent norm of acknowledging and supporting racial division, with a significant portion of the sampled population regarding the preservation of cultural identity as a common and standard practice. This reflects the strong commitment to cultural heritage and the recognition of the impact of historical experiences on shaping their identity within American society.",Travel Advising,"A curious and open-minded traveler planning a trip to the United States, eager to learn about the diverse cultural experiences and history of the country, particularly interested in understanding the perspectives and traditions of various communities","As I'm planning my trip to the U.S., I've heard that there are so many unique communities and cultural experiences to explore. I'm particularly intrigued by the rich history and vibrant traditions of African-American communities. Could you recommend some places or events where I can learn more about how these communities have preserved their cultural heritage and how it's shaped their everyday lives? I'd love to gain a deeper appreciation for the historical context and the way people express their identity through traditions and regional differences."
African Americans,in American society and the United States,"identity, cultural preservation, and political correctness",ethnicity and social interaction,African-Americans and people referring to them,use the term 'African-American' to identify and emphasize heritage and ancestry,African-Americans and second or third-generation African immigrants,accept and identify with the term 'African-American',the term 'African-American' was popularized in the 1990s to replace 'black' and emphasize heritage and ancestry,Community and Identity,0.8,"[50, 60)","{2013: '[0, 10)', 2015: '[0, 10)', 2016: '[0, 10)', 2017: '[0, 10)', 2018: '[0, 10)', 2019: '[0, 10)', 2020: '[0, 10)', 2021: '[0, 10)', 2022: '[20, 30)'}","In American society, particularly among African-Americans and those referring to them, the term ""African-American"" is commonly used to identify and emphasize heritage and ancestry. This behavior serves the goals of preserving cultural identity and promoting political correctness. Second or third-generation African immigrants and African-Americans typically accept and identify with this term, reflecting the importance of ethnicity and social interaction within the community. The term ""African-American"" gained popularity in the 1990s as a replacement for ""black,"" highlighting the significance of heritage and ancestry. This behavior is widely regarded as normative among a significant portion of the sampled population, indicating its acceptance and prevalence within the cultural group.",Travel Advising,"A curious and open-minded traveler planning a trip to the United States, eager to engage with the local culture and understand the nuances of American society","I'm putting together a travel itinerary for my upcoming trip to the States, and I'm really interested in getting to know the local communities. I've heard that there are different ways people identify themselves there. Could you give me some tips on how to respectfully engage in conversations and ask about someone's background without causing offense? I want to make sure I'm being culturally sensitive and open to learning about the diversity within the African-American community."
African Americans,"primarily in the United States, particularly in Atlanta and the rap/hip-hop industry","cultural preservation, promotion, and appreciation","creators, innovators, and influencers","African Americans, including rappers and hip-hop artists","create, innovate, and dominate the rap/hip-hop genre, expressing cultural identity and experiences","listeners, other cultures, and the rap/hip-hop genre","appreciation, imitation, and recognition of cultural influence","emphasis on authenticity, regional variations, and the use of African American Vernacular English (AAVE)",Cultural Exchange,0.7,"[30, 40)","{2012: '[0, 10)', 2014: '[0, 10)', 2015: '[0, 10)', 2016: '[0, 10)', 2017: '[0, 10)', 2018: '[0, 10)', 2019: '[0, 10)', 2020: '[0, 10)', 2021: '[0, 10)', 2022: '[0, 10)'}","In the United States, particularly in Atlanta and the rap/hip-hop industry, African Americans, including rappers and hip-hop artists, play a significant role as creators, innovators, and influencers within the rap/hip-hop genre. Their behavior involves creating and dominating the genre, expressing their cultural identity and experiences, with the goal of preserving, promoting, and appreciating their culture. This behavior is met with appreciation, imitation, and recognition of cultural influence from listeners, other cultures, and the rap/hip-hop genre. Emphasizing authenticity, regional variations, and the use of African American Vernacular English (AAVE), this cultural expression is widely regarded as a normative and influential aspect of the sampled population.",Travel Advising,"An aspiring hip-hop artist from Europe, planning a trip to Atlanta to immerse themselves in the local music scene and gain inspiration for their own work","I'm planning a trip to Atlanta to check out the local music scene and get some inspiration for my own stuff. I've heard that the city's got a really rich hip-hop culture. What should I know about how locals approach music-making there, and how can I make sure I'm being respectful and open to new experiences?"
African Americans,"primarily in the United States, with a focus on income disparity, education, and social mobility",improve quality of life and social mobility,minority-majority,African Americans,"experience income disparity, seek education, and strive for social mobility despite challenges",society and themselves,respond to crimes and provide education,"impact of single motherhood, poverty, and discrimination on education and social mobility",Miscellaneous,0.5,"[20, 30)","{2010: '[0, 10)', 2011: '[0, 10)', 2012: '[0, 10)', 2014: '[0, 10)', 2015: '[0, 10)', 2017: '[0, 10)', 2018: '[0, 10)', 2019: '[0, 10)', 2020: '[0, 10)', 2021: '[0, 10)'}","Within the context of African American communities in the United States, there is a prevalent experience of income disparity, coupled with a strong pursuit of education and social mobility despite facing significant challenges. This striving for improvement aims to enhance the quality of life and achieve upward social mobility. In response, both the community and society at large address issues such as crime and provide educational opportunities. The impact of single motherhood, poverty, and discrimination further influences the pursuit of education and social mobility within this cultural group. However, the behavior is not universally regarded as normative among the sampled population, indicating a significant level of controversy or divergence of opinions regarding these experiences and aspirations.",Travel Advising,"A prospective student from a middle-income family, considering studying in a city with a significant African American population in the United States","I'm planning to study in this vibrant American city known for its rich cultural heritage, and I'm trying to figure out how to best prepare for the experience. I've heard that there are quite a few families here who are really focused on education and upward mobility, and I want to make sure I'm doing everything I can to fit in and contribute to the community. Can you give me some advice on how to navigate this unique social landscape, especially when it comes to education and career aspirations?"
African Americans,hair care routines and salon visits,"achieve frizz-free, air-dried hairstyles, manage and style naturally curly hair, and maintain healthy and moisturized hair",self-care and professional styling,individuals and hair stylists,"use specific hair care products, techniques, and tools, including shampooing, conditioning, applying styling products, and blow drying",hair,respond to hair care products and techniques by maintaining curls and retaining the scent of products,"use of specific hair care products popular among African Americans, such as Curls Blueberry Bliss Leave In Conditioner and Kinky Curly Curling Custard",Beauty and Fashion,1.0,"[20, 30)","{2016: '[0, 10)', 2017: '[0, 10)', 2018: '[0, 10)', 2019: '[0, 10)', 2020: '[0, 10)', 2021: '[0, 10)', 2022: '[0, 10)'}","In the context of hair care routines and salon visits within the African American cultural group, individuals and hair stylists engage in specific hair care practices using tailored products, techniques, and tools to achieve frizz-free, air-dried hairstyles, manage and style naturally curly hair, and maintain healthy, moisturized hair. The use of particular hair care products, such as Curls Blueberry Bliss Leave In Conditioner and Kinky Curly Curling Custard, is prevalent among this cultural group. The goal is for the hair to respond positively to these products and techniques by maintaining curls and retaining the scent of the products. This approach to hair care is widely regarded as the norm within the sampled population, reflecting a high level of consensus and acceptance within the African American community.",Travel Advising,"A curious and beauty-conscious African American woman planning a trip to Europe, eager to maintain her natural hair's health and style without access to her usual products","I'm heading to Europe for a few months and I'm worried about keeping up with my hair care routine. I love my natural curls and I'm concerned about finding the right products that will work for me over there. Can you recommend any tips or strategies for maintaining my hair's health and style while traveling, especially when it comes to finding suitable hair care products and tools in Europe?"
African Americans,"primarily in the United States, including urban and rural areas, and in various regions",communicate effectively and express identity,communication and social interaction,African Americans,"use of African American Vernacular English (AAVE) for communication, including unique grammar, vocabulary, and pronunciation features",other African Americans and non-African Americans,understanding or struggling to understand AAVE,AAVE is a distinct dialect of American English that developed in isolated African American communities during the 19th century,Communication and Language,0.7,"[20, 30)","{2012: '[0, 10)', 2013: '[0, 10)', 2014: '[0, 10)', 2015: '[0, 10)', 2016: '[0, 10)', 2017: '[0, 10)', 2019: '[0, 10)', 2020: '[0, 10)', 2021: '[0, 10)', 2022: '[0, 10)'}","In various urban and rural areas of the United States, African Americans commonly utilize African American Vernacular English (AAVE) as a distinct form of communication. This includes unique grammar, vocabulary, and pronunciation features, serving the dual purpose of effective communication and expression of cultural identity. When interacting with both African Americans and non-African Americans, the use of AAVE may lead to differing levels of understanding, with some individuals struggling to comprehend its nuances. AAVE, a dialect that originated in isolated African American communities during the 19th century, is widely recognized and accepted within the cultural group, with a significant portion of the sampled population regarding its usage as normative.",Travel Advising,"A seasoned business traveler planning a trip to a major city in the United States, eager to engage in casual conversations with locals and gain a deeper understanding of the local culture",I'm heading to [City] for a few weeks on business and I'd love to get a feel for the local vibe. I've heard that people there have a really unique way of speaking. What's the best way for me to connect with folks and make sure I'm not misunderstanding anything?
African Americans,personal grooming and hair care,maintain and enhance curl definition,self-care,individuals with curly hair,"wash, condition, and style hair using various products such as Miss Jessie's Multicultural Curls, Shea Moisture, and Aunt Jessie's, often cowashing and air-drying",their hair,respond to hair care efforts,hair care routines vary based on curl type and climate,Beauty and Fashion,1.0,"[20, 30)","{2016: '[0, 10)', 2017: '[0, 10)', 2018: '[0, 10)', 2019: '[0, 10)', 2020: '[0, 10)', 2021: '[0, 10)', 2022: '[0, 10)'}","In the context of personal grooming and hair care among African Americans with curly hair, it is customary for individuals to meticulously wash, condition, and style their hair using a variety of products like Miss Jessie's Multicultural Curls, Shea Moisture, and Aunt Jessie's. This routine often involves cowashing and air-drying to maintain and enhance the natural curl definition. The recipient of this self-care behavior is the hair itself, responding to the dedicated efforts of the individuals. It is widely regarded as the norm within the sampled population, with variations in hair care routines based on curl type and climate.",Travel Advising,"A first-time traveler from a non-American cultural background, planning a trip to the United States for a business conference, and concerned about fitting in with professional norms while staying true to their personal grooming habits.","I'm getting ready for my first trip to the States for a business conference, and I'm a bit worried about looking professional but also staying true to my grooming routine. I've heard that American work culture is quite formal, but I'm used to taking care of my curly hair in a certain way. What are some tips you could give me to blend in while still being comfortable with my hair care?"
African Americans,"primarily in the United States, with influences globally",musical expression and cultural diffusion,influence and creation,African Americans,"pioneered and significantly influenced various music genres, including jazz, blues, R&B, hip-hop, and rap",other cultures and the American music industry,adoption and promotion of African American music,"traced to African sources, with a notable impact on American music and global music culture",Cultural Exchange,0.7,"[20, 30)","{2014: '[0, 10)', 2015: '[0, 10)', 2017: '[0, 10)', 2018: '[0, 10)', 2019: '[0, 10)', 2020: '[0, 10)', 2021: '[0, 10)', 2022: '[0, 10)'}","Within the United States and with global influence, African Americans have played a pivotal role in pioneering and significantly shaping various music genres such as jazz, blues, R&B, hip-hop, and rap. Their goal has been to express their cultural identity through music and facilitate its diffusion across different cultures. This musical influence has been adopted and promoted by other cultures and the American music industry, leading to a notable impact on American and global music culture. The sampled population widely regards this influence as a significant and normative contribution to the music landscape, showcasing the widespread recognition of African American musical innovation and creativity.",Travel Advising,"A passionate music enthusiast from Europe planning a trip to the United States, eager to explore the roots of jazz and hip-hop culture in their original context","I'm putting together a music-themed itinerary for my upcoming trip to the States, and I'm particularly keen on diving deep into the history of jazz and hip-hop. I've heard that these genres have a rich cultural heritage in America, but I'm not quite sure where to start. Could you recommend some cities or neighborhoods that are known for their vibrant music scenes, and maybe suggest a few local artists or venues that I shouldn't miss? I'm really looking forward to experiencing the authentic vibe of these genres and getting a sense of their cultural significance."
African Americans,in the United States and its history,maintain a sense of identity and distinguish themselves from other Black people,descendants of slaves,African Americans,"struggle to trace their ancestry due to the impact of slavery, leading to a distinct cultural heritage and identity",other Black people and African immigrants,acknowledge their ancestry and experiences,"lack of knowledge about their ancestry, tension, and hostility due to different experiences",Family Traditions and Heritage,0.8,"[20, 30)","{2011: '[0, 10)', 2014: '[0, 10)', 2015: '[0, 10)', 2016: '[0, 10)', 2017: '[0, 10)', 2018: '[0, 10)', 2019: '[0, 10)', 2020: '[0, 10)', 2021: '[0, 10)', 2022: '[0, 10)'}","In the context of the United States and its history, African Americans, particularly those who are descendants of slaves, often grapple with the challenge of tracing their ancestry due to the enduring impact of slavery. This struggle has contributed to the development of a distinct cultural heritage and identity, as they seek to maintain a sense of self and differentiate themselves from other Black people and African immigrants. Recipients of this behavior, such as other Black individuals and African immigrants, are expected to acknowledge the unique ancestry and experiences of African Americans. The lack of knowledge about their ancestry and the resulting tension and hostility due to differing experiences are notable aspects of this cultural dynamic. This behavior is widely regarded as normative within the sampled population.",Travel Advising,"A curious and well-traveled individual planning a trip to the United States, eager to understand the country's rich history and cultural diversity","I'm planning a trip to the US and I've heard that there's a strong sense of community and heritage among certain groups here. Could you recommend any ways or resources that might help me better understand and appreciate the unique experiences of African Americans in the US, especially those who are descendants of slaves? I want to make sure I'm being respectful and aware of the different perspectives that shape this country's history and culture."
African Americans,historically and in contemporary American society,"achieve equality, justice, and preserve culture",minority-majority and oppressed group,African Americans,"fighting for equality, justice, and cultural preservation",society and other racial groups,"discrimination, segregation, and ignorance","historical and contemporary issues including slavery, lynchings, Jim Crow laws, and systemic racism",Community and Identity,0.5,"[20, 30)","{2015: '[0, 10)', 2016: '[0, 10)', 2019: '[0, 10)', 2020: '[0, 10)', 2021: '[0, 10)', 2022: '[0, 10)'}","In historical and contemporary American society, African Americans have been consistently engaged in the fight for equality, justice, and the preservation of their cultural heritage. This struggle is deeply rooted in the context of being a minority-majority and oppressed group, facing discrimination, segregation, and systemic racism. The goal of this activism is to achieve equality and justice while safeguarding their cultural identity. The sampled population is divided in their perception of this behavior, with around half considering it normative, reflecting the ongoing societal debate and differing viewpoints on the African American community's fight for equality and cultural preservation.",Travel Advising,"A white, middle-aged history teacher from a small town in the Midwest, planning a school trip to major cities in the US to expose his students to the country's rich cultural diversity and history.","I'm organizing a school trip to several big cities in the US, and I want my students to get a real taste of the country's vibrant cultural scene. How can I ensure that they not only learn about the historical significance of these cities but also gain an appreciation for the diverse communities that call them home? I'd love to hear your tips on how to create an engaging and inclusive itinerary that reflects the true spirit of America's rich cultural heritage."
African Americans,"urban areas in the United States, particularly in cities like Chicago, New York, and Washington D.C.","seek safety, financial stability, and social acceptance",power dynamics and social interactions,African American individuals and communities,"experience displacement, discrimination, and engage in various strategies for survival, protection, and social mobility","society, including landlords and real estate agents",perpetuate discrimination and neglect,historical and systemic factors contribute to challenges faced by African Americans in urban areas,Environmental Adaptation and Sustainability,0.3,"[5, 20)","{2013: '[0, 10)', 2014: '[0, 10)', 2015: '[0, 10)', 2016: '[0, 10)', 2017: '[0, 10)', 2018: '[0, 10)', 2020: '[0, 10)', 2021: '[0, 10)', 2022: '[0, 10)'}","In urban areas of the United States, particularly in cities like Chicago, New York, and Washington D.C., African American individuals and communities often face displacement, discrimination, and employ various survival strategies to seek safety, financial stability, and social acceptance. Unfortunately, they encounter perpetuated discrimination and neglect from society, including landlords and real estate agents. These challenges are deeply influenced by historical and systemic factors, contributing to the complexities of their experiences. Within this context, the behavior of African Americans seeking survival and social mobility, while facing discrimination and neglect, is considered a significant and contentious issue among the sampled population.",Travel Advising,"A young, ambitious African American artist planning a move to a major urban hub in the US for a year-long residency, seeking advice on how to navigate the city's cultural landscape without facing the same challenges as the local community","I've been offered a year-long residency in one of the big cities, and I'm super excited to be there, but I've heard some stories about how hard it can be for people from my community to find a good place to live and feel welcome. I'm not looking to stir anything up, just want to focus on my art. Can you give me some tips on how to blend in and make the most of my time there without stepping on any toes?"
