cultural group,context,goal,relation,actor,actor_behavior,recipient,recipient_behavior,other_descriptions,topic,agreement,num_support_bin,time_range,eval_whole_desc,eval_scenario,eval_persona,eval_question
South Africans,daily life in South Africa,survival and safety,self and societal,"South Africans, particularly white South Africans","engage in various activities for survival and safety, including living in gated communities, waking up early, and defending themselves",themselves and others,experience culture shock and provide advice,"experience of mundane activities, rush hour traffic, and endlessly complaining on social media",Miscellaneous,1.0,"[5, 20)","{2014: '[0, 10)', 2016: '[0, 10)', 2017: '[0, 10)', 2022: '[0, 10)'}","In daily life in South Africa, particularly among white South Africans, engaging in activities focused on survival and safety is a common practice. This includes residing in gated communities, adhering to early waking routines, and taking measures to defend themselves. The goal of these behaviors is to ensure personal and societal safety. As a result, individuals may experience culture shock and provide advice to others based on their experiences. Mundane activities, rush hour traffic, and expressing grievances on social media are also part of this lifestyle. These practices are widely regarded as normative within the sampled population, reflecting a strong consensus on the importance of prioritizing survival and safety in daily life.",Travel Advising,"A seasoned traveler planning a trip to South Africa, curious about the local lifestyle and eager to blend in with the locals","I'm gearing up for my first trip to South Africa, and I've heard a lot about the local routines. Could you give me some tips on how to navigate the city like a local? I'm particularly interested in understanding the best ways to keep safe and fit in with the daily routines of the people I'll be meeting. Any advice on what to expect and how to adapt would be greatly appreciated."
Black Americans,in the United States and American society,establish and express cultural identity and affinity,cultural identity and comparison,White Americans,"express, maintain, and perceive cultural identity, including language, music, values, and traditions",other Americans and Europeans,acknowledge and respond to cultural similarities and differences,"perception of cultural identity varies, with some focusing on shared characteristics and others emphasizing regional and local differences",Community and Identity,0.8,"[40, 50)","{2010: '[0, 10)', 2013: '[0, 10)', 2014: '[0, 10)', 2015: '[0, 10)', 2017: '[0, 10)', 2018: '[0, 10)', 2019: '[0, 10)', 2020: '[0, 10)', 2021: '[10, 20)', 2022: '[10, 20)'}","In the United States and American society, White Americans actively express, maintain, and perceive their cultural identity, encompassing language, music, values, and traditions. Their goal is to establish and express their cultural identity and affinity, which is often acknowledged and responded to by other Americans and Europeans, emphasizing cultural similarities and differences. The perception of cultural identity varies within this group, with some focusing on shared characteristics while others emphasize regional and local differences. This behavior is widely regarded as a common practice among a significant portion of the sampled population, reflecting the importance of cultural identity and comparison within the context of American society.",Travel Advising,"A curious and open-minded American traveler planning a trip to Europe, eager to engage with local communities and understand their cultural identity",I'm planning a trip to Europe and I'm really excited to meet and connect with locals. I've heard that Europeans are very proud of their cultural heritage and I'm curious about how they express this pride in their everyday lives. Could you give me some tips on how to approach conversations and experiences that might help me better understand and appreciate the unique cultural identities I'll encounter during my travels?
Black Americans,in America and North America,enrich American culture and build trust,contributor and friends,White Americans,"embrace and contribute to American culture, including hunting, farming, and cowboy traditions, while experiencing culture shock when stepping out of America",American culture and Europeans,absorb and respond to cultural contributions,cultural influences include elements from African Americans and European ancestors,Community and Identity,0.6,"[5, 20)","{2011: '[0, 10)', 2016: '[0, 10)', 2019: '[0, 10)', 2020: '[0, 10)', 2021: '[0, 10)', 2022: '[0, 10)'}","In America and North America, White Americans actively embrace and contribute to American culture, engaging in activities such as hunting, farming, and cowboy traditions. Their goal is to enrich American culture and build trust with American society and Europeans, whom they consider as friends and contributors to their cultural experiences. However, when stepping out of America, they may experience culture shock. This cultural exchange is influenced by elements from African Americans and European ancestors, shaping the diverse tapestry of American culture. While this behavior is not universally embraced by the sampled population, it is considered a significant aspect of the cultural landscape.",Travel Advising,"A seasoned traveler planning a trip to North America, curious about the local culture and eager to engage in authentic experiences","I'm putting together my itinerary for a trip to North America, and I'm really excited to immerse myself in the local culture. I've heard there are some unique activities like hunting and farming that I should definitely check out. What's the best way to respectfully engage with these experiences without coming across as intrusive or out of place?"
Black Americans,family and financial support,financial security and expressing disapproval or dislike,parent-child,children,"provide financial support, sometimes reluctantly, due to cultural norms and expectations",parents,accept or refuse support,strong familial bond is not always present; unique American value of self-reliance,Finance and Economy,0.4,"[5, 20)","{2012: '[0, 10)', 2020: '[0, 10)', 2021: '[0, 10)', 2022: '[0, 10)'}","Within the context of family and financial support among White Americans, it is common for children to provide financial assistance to their parents, albeit sometimes reluctantly, in line with cultural norms and expectations. This behavior is driven by the dual goals of ensuring financial security for the parents and expressing disapproval or dislike. The parents, in turn, may choose to accept or refuse this support. It is important to note that a strong familial bond is not always present, reflecting the unique American value of self-reliance. This behavior is considered somewhat controversial or atypical among the sampled population, with around two-fifths expressing a normative view of this practice.",Travel Advising,"A globetrotting consultant from the Midwest planning a trip to visit his recently divorced parents in a small town in the South, concerned about the financial implications of their new living situation","I'm heading down to visit my parents for the first time since their divorce, and I've noticed they're living in a much smaller house than they used to. My mom mentioned they're trying to save money, but I'm worried they might be struggling financially. I've always been pretty independent, but I'm considering offering to help out with some bills during my stay. How can I approach this topic without offending them or making them feel like I'm stepping in too much?"
South Africans,in South Africa,cultural preservation and diversity,cultural exchange and diversity,South Africans,"live in a multicultural society with significant European and Indian influences, preserving cultural roots and engaging in cultural mixing",people from other cultures,participate in cultural exchange,"South Africa is culturally diverse, with a significant population of mixed race people and a history of European and Indian influence",Cultural Exchange,0.7,"[30, 40)","{2012: '[0, 10)', 2014: '[0, 10)', 2015: '[0, 10)', 2017: '[0, 10)', 2018: '[0, 10)', 2019: '[0, 10)', 2020: '[0, 10)', 2021: '[0, 10)', 2022: '[0, 10)'}","In South Africa, the cultural landscape is characterized by a rich tapestry of influences, with South Africans actively preserving their cultural roots while engaging in cultural mixing. This multicultural society is significantly shaped by European and Indian influences, fostering a diverse and inclusive environment. South Africans aim to preserve their cultural heritage and promote diversity, which is reciprocated by people from other cultures participating in cultural exchange. The country's history and population diversity, including a significant mixed-race population, contribute to this vibrant cultural exchange. This behavior is widely regarded as a normative aspect of South African society, reflecting the sampled population's embrace of cultural preservation and diversity.",Travel Advising,"An inquisitive traveler planning a trip to South Africa, eager to engage with the local culture and understand the country's unique blend of traditions",I'm planning my first trip to South Africa and I'm really excited to learn about the local customs and traditions. I've heard that the country has a rich cultural heritage and I'm curious about how people there preserve and share their traditions. Could you give me some tips on how to respectfully engage with and appreciate the local culture during my visit?
South Africans,in South Africa,communicate effectively and reflect population density,national and cultural,people and the country,speak 11 official languages and have a linguistic map influenced by population density,inhabitants and the US,speak and get influenced,South Africa has a multi-cultural background and a larger land mass compared to the US,Cultural Exchange,1.0,"[5, 20)","{2020: '[0, 10)', 2021: '[0, 10)', 2022: '[0, 10)'}","In South Africa, both the people and the country itself engage in the national and cultural behavior of speaking 11 official languages, reflecting the diverse and multi-cultural background of the nation. This linguistic diversity is influenced by population density, creating a unique linguistic map that effectively communicates and reflects the distribution of the population. Inhabitants of South Africa, as recipients, speak these languages and are influenced by this linguistic diversity. The country's vast land mass, in comparison to the US, contributes to this rich linguistic tapestry. This behavior is widely regarded as normative within the sampled population, reflecting the deeply ingrained value of linguistic diversity and effective communication in South African culture.",Travel Advising,"A globetrotting entrepreneur from the United States, planning a business trip to South Africa to expand their network and explore potential partnerships","I'm gearing up for a business trip to South Africa and I'm really excited to meet potential partners. I've heard that English is widely spoken, but I want to make sure I'm respectful and understanding. Could you give me some tips on how to navigate the linguistic landscape there? I want to make a great first impression and show that I value their culture."
Black women,Dating and romantic relationships,Form and maintain romantic relationships,Romantic interest,Black women,"Experience challenges in dating, including fewer matches and less attraction from men","Men, particularly white men",Varying responses from attraction to rejection,Perception of attractiveness and cultural differences play a role,Relationships and Marriage,0.4,"[5, 20)","{2013: '[0, 10)', 2014: '[0, 10)', 2017: '[0, 10)', 2019: '[0, 10)', 2020: '[0, 10)', 2021: '[0, 10)', 2022: '[0, 10)'}","In the context of dating and romantic relationships, Black women often encounter challenges such as receiving fewer matches and experiencing less attraction from men, particularly white men, with whom they may have a romantic interest. The goal for Black women is to form and maintain romantic relationships, but they face varying responses from men, ranging from attraction to rejection. These challenges are influenced by perceptions of attractiveness and cultural differences. Within the sampled population, this experience is considered to be less normative, with a significant portion acknowledging the existence of these challenges.",Travel Advising,"A globetrotting, open-minded Black woman planning a solo travel to Europe, eager to experience the local culture and meet new people, but concerned about the potential challenges she might face in the dating scene","I'm planning a trip to Europe and I'm super excited to meet locals and experience the culture. I've heard that traveling as a solo woman can be a great way to connect with people, but I'm a bit worried about how I might be perceived in the dating scene. I'm not looking for anything serious, just some casual dating or maybe even a fling. How can I navigate this aspect of my travels without feeling like I'm being overlooked or rejected?"
Black women,interactions with white men and societal expectations,"maintain hair, avoid culture shock, and express personal identity",interactions and societal norms,Black women,"engage in hair care practices, including wearing wigs and satin bonnets, to maintain and protect their hair",white men and society,"curiosity, avoidance of hair touching without permission, and sometimes negative influences",cultural differences and societal expectations influence hair care practices,Beauty and Fashion,0.7,"[5, 20)","{2016: '[0, 10)', 2019: '[0, 10)', 2020: '[0, 10)', 2021: '[0, 10)', 2022: '[0, 10)'}","In interactions with white men and societal expectations, Black women often engage in hair care practices such as wearing wigs and satin bonnets to maintain and protect their hair. These practices serve the dual purpose of preserving their hair and expressing their personal identity while avoiding culture shock. White men and society, in turn, respond with curiosity, an understanding of the importance of hair and sometimes negative influences. The differences in cultural norms and societal expectations significantly influence these hair care practices. This behavior is considered relatively normative within the sampled population, reflecting a significant acceptance of these practices within the cultural group.",Travel Advising,"A Black woman preparing for a business trip to the United States, eager to present herself professionally and respect local customs","I'm heading to the U.S. for a business trip and I want to make sure I look my best. I've heard that hair care is really important there, and I want to blend in while still staying true to myself. Could you give me some tips on how to take care of my hair without causing any cultural misunderstandings? I've heard that some locals might have different expectations about how I should present myself, and I want to make sure I'm being respectful."
Black women,"various settings including school, work, and society at large","expressing identity, cultural preservation, and self-expression",minority group vs. majority group,Black women and girls,"expressing cultural identity through hairstyles such as afro braids, box braids, and natural hair",society and institutions,"policing, judging, and labeling","complex history of cultural assimilation, racial insensitivity, and marginalization",Community and Identity,0.4,"[5, 20)","{2019: '[0, 10)', 2020: '[0, 10)', 2022: '[0, 10)'}","In various settings including school, work, and society at large, Black women and girls often express their cultural identity through hairstyles such as afro braids, box braids, and natural hair. This behavior serves as a means of expressing identity, preserving their cultural heritage, and asserting their self-expression. However, this expression is often met with policing, judgment, and labeling from society and institutions, reflecting the complex history of cultural assimilation, racial insensitivity, and marginalization. Within the sampled population, this behavior is considered controversial and is not widely regarded as the norm, indicating that it faces resistance and scrutiny from the majority group.",Travel Advising,"A globetrotting fashion designer from the United States, particularly interested in exploring the diverse beauty standards and expressions of identity around the world, planning a trip to Paris to gather inspiration for her next collection","I'm heading to Paris soon for a fashion research trip and I'm really excited to immerse myself in the local culture. I've heard that Parisians are quite fashion-forward, and I'm curious about how they perceive and express their own sense of style. I'm particularly interested in learning about the different ways people there celebrate and embrace their unique identities, especially in terms of hair and beauty. Could you give me some tips on how to approach this topic with locals, and maybe suggest some places where I can observe and appreciate these expressions of personal style?"
Black women and their partners,in interracial relationships,express and understand cultural differences,partners or dating,Black women,emphasize cultural differences and expect understanding of their culture,"partners, often white men",learn about and appreciate the woman's culture,cultural differences are seen as a challenge but also an opportunity for learning,Cultural Exchange,0.4,"[5, 20)","{2021: '[0, 10)', 2022: '[0, 10)'}","In interracial relationships involving Black women and their partners, particularly white men, it is common for the women to emphasize cultural differences and expect their partners to understand and appreciate their culture. The goal is to express and understand these differences, fostering a mutual appreciation for each other's backgrounds. This behavior is perceived as both a challenge and an opportunity for learning within the cultural context. However, it is not universally embraced by a significant portion of the sampled population, indicating that it is considered somewhat controversial or less common among the group.",Relationship Advising,"A newly engaged Black woman in a relationship with a white man, looking forward to a harmonious future together","My fiance and I are really excited about our future together, but I've noticed that we sometimes struggle to understand each other's cultural perspectives. I'm from a diverse background and I'd love for us to really appreciate and celebrate our differences. Do you have any tips on how we can foster a deeper understanding and appreciation of each other's cultural backgrounds? Especially when it comes to navigating differences in our everyday lives."
Black women,Various social and public settings,"Self-expression, self-confidence, and attracting attention",Self-expression and interaction with others,Black women,"Expressing self-confidence, being themselves, and engaging in self-expression through fashion and body language",People around them,Observing and expressing admiration,Perception of beauty and attractiveness,Community and Identity,0.6,"[5, 20)","{2018: '[0, 10)', 2019: '[0, 10)', 2021: '[0, 10)', 2022: '[0, 10)'}","In various social and public settings, Black women are often seen expressing self-confidence and being true to themselves through their fashion choices and body language. This behavior serves as a means of self-expression, self-confidence, and a way to attract attention. People around them typically observe and express admiration for their self-assuredness and unique style. This self-expression is closely tied to the perception of beauty and attractiveness within this cultural group. While not universally embraced by the entire sampled population, a significant portion acknowledges and accepts this behavior as a normative form of self-expression and confidence among Black women.",Fashion Consulting,A young African American woman exploring different fashion styles to reflect her personality and confidence,"I'm really into fashion and I want to make sure my style is a true reflection of who I am. I've noticed that there are so many ways to express myself through what I wear. Could you give me some advice on how to choose clothing that not only looks great but also makes me feel confident and empowered, just like the women I admire?"
Black community,"American music industry, particularly rap and gangsta rap","expressing their opinions and experiences, enjoying music, and profiting from it",creators and consumers of music,Black artists and the Black community,"create and consume music that reflects their experiences and culture, but also face criticism for cultural appropriation and misrepresentation",Black community and white suburban teenagers,creation and consumption of music,"music is a form of cultural expression and representation, with some criticism towards non-Black artists for cultural appropriation",Cultural Exchange,0.2,"[5, 20)","{2012: '[0, 10)', 2018: '[0, 10)', 2020: '[0, 10)', 2021: '[0, 10)', 2022: '[0, 10)'}","In the American music industry, particularly within rap and gangsta rap, Black artists and the Black community engage in creating and consuming music that authentically reflects their experiences and culture. However, they also encounter criticism for cultural appropriation and misrepresentation. This music serves as a form of cultural expression and representation, allowing the creators to express their opinions and experiences while also profiting from their art. The behavior of both creating and consuming this music is not universally accepted, with some criticism directed towards non-Black artists for cultural appropriation. This behavior is considered controversial and is not widely regarded as normative among the sampled population, reflecting the complex dynamics of cultural representation and ownership within the music industry.",Travel Advising,"A young, aspiring rapper from the UK, deeply influenced by the American rap scene, planning a trip to the US to immerse themselves in the culture and gain inspiration for their own music.","I'm planning a trip to the States soon, and I'm really excited to experience the American rap scene firsthand. I've always been a huge fan of the genre, but I want to make sure I'm respectful and knowledgeable about the cultural significance of rap in different communities. Could you give me some advice on how to engage with the music scene in a way that's both respectful and enriching for my own art?"
Africans,global sports events,achieve high speeds and success,performers to observers,Africans,"achieve high performance in various sports, particularly long distance running and sprinters/jumpers events",global audience,observe and recognize African abilities,genetics and geographical distribution play a role,Sports and Recreation,1.0,"[5, 20)","{2012: '[0, 10)', 2018: '[0, 10)', 2020: '[0, 10)', 2022: '[0, 10)'}","During global sports events, Africans are known for excelling in various sports, particularly in long distance running and sprinting/jumping events. Their goal is to achieve high performance and success, showcasing their exceptional abilities and achieving remarkable speeds. The global audience, in the role of observers, recognizes and acknowledges the athletic prowess of African performers. This phenomenon is influenced by genetics and geographical distribution, contributing to their athletic achievements. Within the sampled population, this behavior is widely regarded as normative, with a significant portion acknowledging and appreciating the athletic capabilities of Africans in global sports events.",Travel Advising,"An avid runner and travel enthusiast from Europe, planning a trip to Africa for a marathon event","I'm gearing up for my first marathon in Africa and I've heard so much about the incredible athletic talent there. I've always been into running, but I'm curious, how can I best prepare myself for this experience? Are there any specific training tips or cultural nuances I should be aware of to fully embrace and appreciate the local running culture?"
East Africans,in East Africa,show affection and friendship,friendship or affection,people,"express friendship and affection through physical touch, such as holding hands, hugging, and kissing cheeks",each other,,actions and verbal affirmation,Social Norms and Etiquette,0.8,"[5, 20)","{2016: '[0, 10)', 2022: '[0, 10)'}","In East African culture, people express friendship and affection towards each other through physical touch, including holding hands, hugging, and kissing on the cheeks. These actions, combined with verbal affirmation, serve as a means to demonstrate warmth and closeness in relationships. This behavior is widely regarded as a normative way of showing affection and friendship within the sampled population.",Travel Advising,"An American traveler planning a trip to East Africa, eager to connect with the locals but unsure about the best way to express friendliness and affection without overstepping boundaries","I'm really looking forward to my trip to East Africa and I want to make sure I'm being respectful and friendly with the locals. I've heard that people are really warm and welcoming there, but I'm a bit unsure about how to show that I'm interested in getting to know them better. Could you give me some advice on how to approach and interact with people in a way that feels natural and respectful?"
