cultural group,context,goal,relation,actor,actor_behavior,recipient,recipient_behavior,other_descriptions,topic,agreement,num_support_bin,time_range,eval_whole_desc,eval_scenario,eval_persona,eval_question
Black people,historical and contemporary contexts of racial oppression and cultural assimilation,"expressing themselves, preserving their culture, and ending derogatory treatment based on race",oppressed and oppressor,Black people,"creating and preserving their own culture, including blues music, while facing derogatory treatment and cultural appropriation",white people,"taking and imitating black culture, using derogatory terms","historical context of slavery, civil rights movement, and cultural assimilation",Community and Identity,0.3,"[5, 20)","{2013: '[0, 10)', 2015: '[0, 10)', 2016: '[0, 10)', 2019: '[0, 10)'}","In the historical and contemporary contexts of racial oppression and cultural assimilation, Black people have been observed to create and preserve their own culture, including the influential blues music, while enduring derogatory treatment and cultural appropriation. Their goal is to express themselves, safeguard their cultural heritage, and put an end to the derogatory treatment based on race. Conversely, white people have been noted to appropriate and imitate aspects of Black culture, often using derogatory terms. This behavior is influenced by the historical context of slavery, the civil rights movement, and cultural assimilation. However, the sampled population views this behavior as controversial and not widely accepted, indicating that it is considered an unusual practice within the cultural group.",Travel Advising,"A young, adventurous traveler from the United States, planning a trip to the South to immerse themselves in the rich musical heritage of the region. They are keen on understanding the cultural significance of various music styles and how they are perceived by the local communities.","I'm planning a trip to the South to explore the local music scene, especially blues. I've heard that there's a lot of cross-pollination and appreciation for different musical styles in the region. I'm curious about how the local communities view this cultural exchange and what they consider as authentic or respectful when it comes to music. Any tips on how to engage with the local music scene without stepping on any toes?"
Black people,multicultural societies and communities,understanding and maintaining cultural identity,comparison and interaction,Black folks and individuals,"express and maintain a strong cultural identity, including overt sexuality, sharing cultural practices, and valuing skin color",White folks and others,acknowledge and respect cultural differences,"emphasis on geography, religion, class, and familial relations in shaping culture",Community and Identity,0.8,"[5, 20)","{2011: '[0, 10)', 2017: '[0, 10)', 2020: '[0, 10)', 2021: '[0, 10)', 2022: '[0, 10)'}","In multicultural societies and communities, it is common for Black folks and individuals to express and uphold a strong cultural identity, which includes overt expressions of sexuality, sharing cultural practices, and valuing skin color. The goal of this behavior is to understand and maintain their cultural identity. In comparison and interaction with White folks and others, the expected behavior is to acknowledge and respect these cultural differences. Additionally, there is an emphasis on the influence of geography, religion, class, and familial relations in shaping this cultural identity. This behavior is widely regarded as normative within the sampled population, indicating a high level of acceptance and recognition of the importance of cultural identity within the Black community.",Travel Advising,"A curious and open-minded traveler planning a trip to a diverse city in the United States, eager to engage with and learn from the local communities","I'm putting together a travel itinerary for a city known for its rich cultural tapestry here in the U.S. I've heard that people there are very proud of their heritage and often express it openly. As someone who appreciates the beauty of cultural diversity, I'm wondering how I can be more mindful and respectful when interacting with the locals. Could you share some tips on how to approach and engage with the community in a way that acknowledges and celebrates their unique identity?"
Black people and their perceptions by others,primarily in North America,"identification, categorization, or addressing/referring to individuals",group membership and intergroup,Black people and others referring to them,"use of various terms to refer to or describe Black people, including 'the blacks', 'black people', and the N-word, often with a focus on identification or categorization",Black people and white people,none or use of similar terms,use of characterizing adjectives as nouns and creation of vocabulary to separate people into us/them,Community and Identity,0.4,"[5, 20)","{2015: '[0, 10)', 2021: '[0, 10)', 2022: '[0, 10)'}","In the context of North America, there is a complex intergroup dynamic involving the use of various terms to refer to or describe Black people, such as 'the blacks', 'black people', and the N-word. This behavior is often focused on identification, categorization, or addressing individuals within the Black community. Additionally, characterizing adjectives are used as nouns, and vocabulary is created to separate people into ""us"" and ""them"". This behavior is perceived as controversial and highly debated among the sampled population, with a significant portion expressing differing views on its appropriateness.",Travel Advising,"A first-time traveler to the United States, hailing from a country where racial dynamics are quite different. They've been warned about the complexities of race relations in the US and are curious about how to navigate these issues during their trip, particularly in their interactions with locals.","I've heard a lot about the racial dynamics in the US, especially when it comes to how people talk about race. I'm planning to travel there soon, and I really want to make sure I'm respectful and sensitive in my interactions with people. Can you give me some tips on how to navigate these conversations without accidentally causing offense or misunderstanding? I want to be a responsible and aware traveler, but I'm not sure where to start."
Black people,in diverse and multicultural settings,"to foster understanding, validation, and a sense of belonging",friendship and social interaction,individuals seeking diversity and inclusion,actively engage with and learn from diverse cultures,people of other races and ethnicities,provide understanding and validation of the actor's cultural background,experiences of isolation and being the only black person in a group,Cultural Exchange,0.8,"[5, 20)","{2013: '[0, 10)', 2014: '[0, 10)', 2015: '[0, 10)', 2021: '[0, 10)', 2022: '[0, 10)'}","In diverse and multicultural settings, individuals seeking diversity and inclusion from the Black cultural group actively engage with and learn from diverse cultures, aiming to foster understanding, validation, and a sense of belonging. In return, people of other races and ethnicities reciprocate by providing understanding and validation of the actor's cultural background, nurturing friendship and social interaction. However, it is important to note that individuals from the Black cultural group may also experience feelings of isolation when being the only Black person in a group. This behavior is widely regarded as normative by a significant portion of the sampled population, reflecting a strong inclination towards promoting diversity, inclusion, and cross-cultural understanding.",Travel Advising,"A globetrotting entrepreneur from the United States, deeply committed to fostering diversity and inclusivity in their business ventures, and eager to navigate new cultural landscapes with sensitivity and understanding.","I'm planning a business trip to a new city and I'm determined to ensure that my interactions with local communities are respectful and engaging. I've noticed that there's a strong emphasis on embracing diversity and fostering cross-cultural understanding in the places I'm visiting. How can I best prepare myself to contribute positively to these values, and what are some key strategies for making the most of my time with local businesses and residents?"
White and Black Americans,in the United States,preserve cultural identity and promote cultural integration,coexistence and integration,people of all backgrounds,strive to maintain cultural identity and integrate into American society,each other,adapt to and integrate into American culture,"multiculturalism, adjustment, and cultural shock",Cultural Exchange,0.5,"[5, 20)","{2007: '[0, 10)', 2015: '[0, 10)', 2017: '[0, 10)', 2019: '[0, 10)', 2020: '[0, 10)', 2021: '[0, 10)'}","In the United States, people of all backgrounds, including White and Black Americans, actively strive to maintain their cultural identity while integrating into American society. The goal is to preserve their cultural heritage while promoting integration into the broader American culture. This dynamic involves reciprocal adaptation, where individuals from different cultural backgrounds work to integrate into American society while also embracing and preserving their own cultural identity. The process is characterized by multiculturalism, adjustment, and the experience of cultural shock. The behavior of striving to maintain cultural identity while integrating into American society is perceived as moderately normative among the sampled population, indicating that it is a common and accepted practice, albeit not universally embraced.",Travel Advising,"A young, inquisitive German immigrant preparing for a trip to the United States to visit family and explore the cultural diversity","I'm planning a trip to the U.S. to visit my cousins and I'm really excited to experience the American way of life. My cousins have been there for a while now and they're quite proud of their heritage. I'm curious, how do I best navigate and appreciate the unique blend of cultures in the U.S. without stepping on any toes or missing out on the authentic experiences?"
Black Americans,within America and globally,"cultural preservation, identity formation, and understanding",cultural and identity-based,Black Americans and Africans,"express, preserve, and distinguish cultural identity, including language, traditions, and shared experiences",each other and society,acknowledge and respect cultural differences,"cultural identity is influenced by shared experiences, including oppression and diaspora, and is distinct from other cultures",Community and Identity,0.9,"[60, 70)","{2010: '[0, 10)', 2011: '[0, 10)', 2013: '[0, 10)', 2014: '[0, 10)', 2015: '[0, 10)', 2016: '[0, 10)', 2017: '[0, 10)', 2018: '[0, 10)', 2019: '[0, 10)', 2020: '[10, 20)', 2021: '[0, 10)', 2022: '[20, 30)'}","Within America and globally, Black Americans and Africans actively express, preserve, and distinguish their cultural identity through language, traditions, and shared experiences. This behavior aims to preserve their cultural heritage, form a strong sense of identity, and foster mutual understanding. It is essential for both groups to acknowledge and respect each other's cultural differences, reflecting a cultural and identity-based relationship. The cultural identity of Black Americans and Africans is influenced by shared experiences of oppression and diaspora, setting it apart from other cultures. This behavior is widely regarded as normative within the sampled population, indicating a high level of acceptance and recognition of the importance of cultural preservation and identity formation within the Black American community.",Travel Advising,An African American artist planning a trip to Europe to showcase their work and connect with the local art scene,"I'm an African American artist planning a trip to Europe to exhibit my work and engage with the local art community. I'm really excited about this opportunity, but I'm also a bit nervous about how I'll be perceived and how I can best represent my cultural background. Could you give me some tips on how to navigate these cultural nuances and make the most of my trip?"
Black Americans,"primarily in America, with some influence globally",express cultural identity and influence global music trends,creators and participants in music culture,Black Americans,"create and participate in various forms of music, including soul, jazz, hip hop, R&B, and rap, as a form of cultural expression and identity",global audience,"listen, enjoy, and be influenced by the music",Black Americans have made significant contributions to American and global music culture,Community and Identity,0.7,"[20, 30)","{2013: '[0, 10)', 2016: '[0, 10)', 2017: '[0, 10)', 2018: '[0, 10)', 2020: '[0, 10)', 2021: '[0, 10)', 2022: '[0, 10)'}","In America, particularly within the Black American community, there is a strong tradition of creating and participating in various music genres such as soul, jazz, hip hop, R&B, and rap. This musical expression serves as a means to convey cultural identity and has a significant influence on global music trends. Black American musicians and artists have made substantial contributions to American and global music culture, shaping and enriching the musical landscape. The global audience actively listens to, enjoys, and is influenced by this music, reflecting the normative nature of Black American musical expression within the sampled population.",Travel Advising,"A young, musically inclined German tourist planning a trip to America, eager to explore the vibrant music scene but unsure of where to start and how to engage with the local music community","I'm a huge fan of music and I've heard that America has a rich musical heritage, especially within the Black American community. I'm planning a trip there soon and I'd love to immerse myself in the local music scene. I'm particularly interested in jazz and hip hop. Any tips on where to go, what to listen to, and maybe even how to connect with local musicians? I want to make sure I'm respecting the culture and traditions while I'm there."
Black Americans,in the United States,"achieve equal status, celebrate achievements, and cope with systemic racism",ranges from in-group to minority-majority,Black individuals and communities,"engage in celebrations, self-improvement, and activism to affirm identity, cultural heritage, and resist oppression","varies, including other Black individuals, America, and the majority",may vary from celebrating to committing racism,"influenced by a shared history of oppression, enslavement, and generational poverty",Community and Identity,0.6,"[5, 20)","{2013: '[0, 10)', 2014: '[0, 10)', 2015: '[0, 10)', 2016: '[0, 10)', 2018: '[0, 10)', 2019: '[0, 10)', 2020: '[0, 10)', 2021: '[0, 10)', 2022: '[0, 10)'}","In the United States, Black individuals and communities engage in various forms of celebrations, self-improvement, and activism to affirm their cultural identity, heritage, and to resist oppression. These actions serve the goals of achieving equal status, celebrating achievements, and coping with systemic racism. The recipients of these behaviors vary, ranging from other Black individuals to the majority population, with responses varying from celebration to committing racism. This cultural behavior is deeply influenced by a shared history of oppression, enslavement, and generational poverty. While not universally embraced, a significant portion of the sampled population regards these actions as a common and normative way for Black Americans to assert their identity and address systemic challenges.",Travel Advising,"A curious and open-minded traveler from abroad, planning a trip to the United States for the first time, eager to learn about and engage with the country's diverse communities and histories.","I'm planning a trip to the US for the first time and I've heard about the rich cultural tapestry of the country, especially the vibrant communities that have shaped its history. I'm particularly interested in understanding the unique ways in which people celebrate their heritage and work towards equality. Could you recommend some places or events where I can witness these expressions of identity and resilience? I'd love to learn more about the shared experiences and challenges that have shaped these communities, and how they continue to thrive and contribute to the larger American narrative."
Black Americans,in various neighborhoods across the United States,"expressing cultural identity, living in a community, and fostering cultural understanding",community members and neighbors,Black individuals and families,"expressing their unique cultural identity, living in diverse neighborhoods, and interacting with others",other residents and neighbors,maintaining cultural practices and interacting with Black individuals,ranging from impoverished to more affluent neighborhoods,Community and Identity,0.7,"[5, 20)","{2016: '[0, 10)', 2018: '[0, 10)', 2020: '[0, 10)', 2022: '[0, 10)'}","In various neighborhoods across the United States, Black individuals and families are commonly observed expressing their unique cultural identity and living in diverse communities. They interact with other residents and neighbors, aiming to foster cultural understanding and maintain their cultural practices. These interactions occur in neighborhoods ranging from impoverished to more affluent, showcasing the diversity within the Black American community. This behavior is considered a standard and widely accepted practice among a significant portion of the sampled population, reflecting the norm of cultural expression and community engagement within Black American neighborhoods.",Travel Advising,"A curious and open-minded traveler planning a trip to the United States, eager to learn about the diverse communities and their daily lives",I'm planning a trip to the US and I've heard that there's a lot of diversity in the neighborhoods. I'm really interested in learning about the different ways people live and express themselves in their communities. Could you recommend some neighborhoods or areas where I can observe and maybe even participate in the local culture? I'd love to get a feel for the day-to-day life and see how people interact with their neighbors.
Black Americans,"primarily in the United States, with a focus on Chicago and the last week of December",to honor and connect to African heritage,promoting and celebrating,"Black Americans, including Al Sharpton and families with roots in the 1960s and 1970s",celebrate Kwanzaa as a means to honor African heritage and cultural roots,themselves and their community,participate in the celebration,,Cultural Traditions and Festivals,0.9,"[5, 20)","{2022: '[10, 20)'}","In the United States, particularly in Chicago during the last week of December, Black Americans, including prominent figures like Al Sharpton and families with roots in the 1960s and 1970s, engage in the celebration of Kwanzaa as a way to honor their African heritage and cultural roots. This celebration serves as a means to promote and connect with their African heritage, with the goal of fostering a sense of unity and pride within their community. The participation in Kwanzaa is widely regarded as a normative and common practice among the sampled population, reflecting the significance and widespread acceptance of this cultural celebration within the Black American community.",Travel Advising,"A curious and open-minded traveler planning a trip to Chicago during the holiday season, eager to learn about and respectfully participate in local traditions and festivities",I'm planning a visit to Chicago around the end of December and I've heard that there are some unique celebrations happening in the city. I'd love to experience something authentic and community-oriented. Could you recommend any events or activities that showcase the local spirit and might be of particular interest to someone looking to immerse themselves in the city's cultural traditions?
Black Americans,"within the US, including specific locations like Baltimore",socializing and bonding,interacting with or being of different demographics,Black people,"engage in social interactions, including making jokes and hanging out, often with a focus on cultural familiarity and shared interests",people from other demographics,accepting or reciprocating social interactions,experience of culture shock when encountering different demographics,Cultural Exchange,0.7,"[5, 20)","{2014: '[0, 10)', 2016: '[0, 10)', 2020: '[0, 10)', 2021: '[0, 10)', 2022: '[0, 10)'}","Within the US, particularly in locations like Baltimore, Black Americans commonly engage in social interactions with people from other demographics, often centered around making jokes, hanging out, and emphasizing cultural familiarity and shared interests. The goal of these interactions is to socialize and bond, with individuals from other demographics reciprocating and accepting these social engagements. However, it is noted that there may be instances of culture shock when encountering individuals from different demographics. This behavior is regarded as fairly common among the sampled population, with a significant portion acknowledging it as a normative aspect of Black American culture within the specified context.",Travel Advising,"A seasoned traveler planning a trip to Baltimore, curious about the local social scene and eager to fit in with the locals",I'm gearing up for a visit to Baltimore and I've heard it's quite the vibrant city. I'm all about making connections and having a good time. Any tips on how to navigate the local social circles? I want to make sure I'm not stepping on any toes or missing out on any fun. How do I go about making friends and getting invited to some of those legendary hangouts?
Black Americans,"across various historical and geographical settings including slavery, Southern plantations, Northern cities, and America",preserve and gain cultural touchstone,segregation and self-preservation,Black Americans,developed and preserved their unique cultural identity through a mix of African traditions and adaptations to slavery,White Americans and themselves,maintained separate public spaces,"loss and adaptation due to slavery, including specific foods, traditions, music, religion, and language",Cultural and Environmental Appreciation,0.7,"[5, 20)","{2011: '[0, 10)', 2016: '[0, 10)', 2017: '[0, 10)', 2020: '[0, 10)', 2021: '[0, 10)', 2022: '[0, 10)'}","Across various historical and geographical settings, including slavery, Southern plantations, Northern cities, and America, Black Americans have developed and preserved their unique cultural identity through a blend of African traditions and adaptations to slavery. This behavior aims to preserve and gain a cultural touchstone, reflecting a form of self-preservation and resistance to segregation. As a result of slavery, there has been a loss and adaptation of specific foods, traditions, music, religion, and language within the Black American community. This preservation of cultural identity and the maintenance of separate public spaces is widely regarded as a normative practice among a significant portion of the sampled population.",Travel Advising,"A curious and open-minded food enthusiast planning a trip to the Southern United States, eager to learn about the rich culinary traditions and history of the region.",I'm planning a foodie tour through the South and I've heard that there's a lot of fusion in the cuisine there. Could you recommend some dishes that really capture the essence of the region's history and cultural influences? I'm especially interested in learning about how different communities have shaped the local food scene.
